{
  "figure_type": "grouped_bar",
  "layout_priors": {
    "aspect_ratio": 1.2,
    "recommended_width_mm": 89
  },
  "provenance": {
    "adaptation": "concept_and_parameter_adaptation_only",
    "imported_files": [],
    "license": "Apache-2.0",
    "source": "academic-figure-skill"
  },
  "schema": "scientificfigure.figure_prior.v1",
  "style_tokens": {
    "bar_alpha": 0.88,
    "edge_line_width_pt": 0.5,
    "errorbar_line_width_pt": 0.7
  },
  "supported_data_signature": {
    "optional": [
      "group",
      "yerr",
      "n"
    ],
    "required": [
      "category",
      "value"
    ]
  }
}
