{
  "figure_type": "scatter_regression",
  "layout_priors": {
    "aspect_ratio": 1.0,
    "recommended_width_mm": 89
  },
  "provenance": {
    "adaptation": "concept_and_parameter_adaptation_only",
    "imported_files": [],
    "license": "Apache-2.0",
    "source": "academic-figure-skill"
  },
  "schema": "scientificfigure.figure_prior.v1",
  "style_tokens": {
    "fit_line_width_pt": 1.0,
    "marker_alpha": 0.78,
    "marker_size_pt": 4.5
  },
  "supported_data_signature": {
    "optional": [
      "group",
      "fit",
      "ci"
    ],
    "required": [
      "x",
      "y"
    ]
  }
}
